{
  "id": "blackjack-bj-1",
  "chassis": "Blackjack",
  "model": "BJ-1",
  "unitType": "BattleMech",
  "configuration": "Biped",
  "techBase": "INNER_SPHERE",
  "rulesLevel": "STANDARD",
  "era": "STAR_LEAGUE",
  "year": 2757,
  "tonnage": 45,
  "engine": {
    "type": "FUSION",
    "rating": 180
  },
  "gyro": {
    "type": "STANDARD"
  },
  "cockpit": "STANDARD",
  "structure": {
    "type": "STANDARD"
  },
  "armor": {
    "type": "STANDARD",
    "allocation": {
      "LEFT_ARM": 12,
      "RIGHT_ARM": 12,
      "LEFT_TORSO": {
        "front": 15,
        "rear": 6
      },
      "RIGHT_TORSO": {
        "front": 15,
        "rear": 6
      },
      "CENTER_TORSO": {
        "front": 18,
        "rear": 9
      },
      "HEAD": 9,
      "LEFT_LEG": 17,
      "RIGHT_LEG": 17
    }
  },
  "heatSinks": {
    "type": "SINGLE",
    "count": 11
  },
  "movement": {
    "walk": 4,
    "jump": 4
  },
  "equipment": [
    {
      "id": "autocannon-2",
      "location": "LEFT_ARM"
    },
    {
      "id": "autocannon-2",
      "location": "RIGHT_ARM"
    },
    {
      "id": "medium-laser",
      "location": "LEFT_ARM"
    },
    {
      "id": "medium-laser",
      "location": "RIGHT_ARM"
    },
    {
      "id": "medium-laser",
      "location": "LEFT_TORSO"
    },
    {
      "id": "medium-laser",
      "location": "RIGHT_TORSO"
    }
  ],
  "criticalSlots": {
    "LEFT_ARM": [
      "Shoulder",
      "Upper Arm Actuator",
      "Medium Laser",
      "Autocannon/2",
      null,
      null,
      null,
      null,
      null,
      null,
      null,
      null
    ],
    "RIGHT_ARM": [
      "Shoulder",
      "Upper Arm Actuator",
      "Medium Laser",
      "Autocannon/2",
      null,
      null,
      null,
      null,
      null,
      null,
      null,
      null
    ],
    "LEFT_TORSO": [
      "Heat Sink",
      "Heat Sink",
      "Medium Laser",
      null,
      null,
      null,
      null,
      null,
      null,
      null,
      null,
      null
    ],
    "RIGHT_TORSO": [
      "Heat Sink",
      "Heat Sink",
      "Medium Laser",
      null,
      null,
      null,
      null,
      null,
      null,
      null,
      null,
      null
    ],
    "CENTER_TORSO": [
      "Fusion Engine",
      "Fusion Engine",
      "Fusion Engine",
      "Gyro",
      "Gyro",
      "Gyro",
      "Gyro",
      "Fusion Engine",
      "Fusion Engine",
      "Fusion Engine",
      "IS Ammo AC/2",
      null
    ],
    "HEAD": [
      "Life Support",
      "Sensors",
      "Cockpit",
      null,
      "Sensors",
      "Life Support"
    ],
    "LEFT_LEG": [
      "Hip",
      "Upper Leg Actuator",
      "Lower Leg Actuator",
      "Foot Actuator",
      "Jump Jet",
      "Jump Jet"
    ],
    "RIGHT_LEG": [
      "Hip",
      "Upper Leg Actuator",
      "Lower Leg Actuator",
      "Foot Actuator",
      "Jump Jet",
      "Jump Jet"
    ]
  },
  "quirks": [
    "bad_rep_is"
  ],
  "fluff": {
    "overview": "The original contract between General Motors and the SLDF sought for \"a medium BattleMech with insurrection suppression and fire-support capabilities.\" The outcome was the Blackjack. Despite meeting all of its production requirements, the Blackjack gained an unjust reputation and was rejected by the Star League.",
    "capabilities": "The Blackjack's original mission was to assist in suppressing insurgent groups (mostly in the Periphery) that defied Star League authority in the decades preceding its demise. The Blackjack is only a minor success in its secondary capacity as a fire support platform. The autocannons lacked the firepower to take on heavily defended targets. At close range, though, the combination of lasers poses a significantly bigger threat. The addition of jump jets came late in the design phase, but the Whitworth Jetlift units have proven to be a vital asset over the decades. The Blackjack's sole significant disadvantage was negative press, which stated that the entire project was a shambles because the 'Mech's basic architecture was defective and unstable. The 'Mech's tiny footpads were alleged to cause falls and hamper maneuverability, or that the StarGuard II armor was brittle and tended to break off. Despite the fact that none of these accusations were ever proven, the Blackjack went out of favor, and few grieved the loss of GM's production line.",
    "history": "The Blackjack had limited use in the Star League, and manufacture was shortly discontinued. Relegated to service with Hegemony planetary militia or sold to League member nations, it can still be encountered on the battlefield today. The majority of them now fight for the Capellan Confederation and the Federated Suns. The Confederation has nothing but disdain for the design. The breakaway St. Ives Compact, on the other hand, could not be as picky, and the Blackjack serves in the St. Ives Lancers. The Federated Suns used the Blackjack in the March Militias until the myth of the Blackjack's inferiority was busted on Xhosa VII in 3022. The Crucis Lancers and Deneb Light Cavalry were re-interested in the 'Mech.",
    "deployment": "The Blackjack carries a 40mm Whirlwind-L AC/2 in either arm for long range, direct fire support. While these autocannons provide excellent reach and were sufficient for combating mostly non-'Mech insurgents, they lacked the firepower to deal with well-armored targets. Both weapons are fed from a single ton of ammo located within the center torso. For close combat, the Blackjack has four Intek medium lasers, one in each arm and both the left and right sides of the torso. These lasers, when combined with its maneuverability, make the 'Mech very dangerous and an entire lance or company of Blackjacks can lay down impressive firepower.",
    "manufacturer": "General Motors",
    "primaryFactory": "Kathil",
    "systemManufacturer": {
      "CHASSIS": "GM BJ-1",
      "ENGINE": "GM 180",
      "ARMOR": "StarGuard II",
      "JUMPJET": "Whitworth Jetlift",
      "COMMUNICATIONS": "Dalban Micronics",
      "TARGETING": "Dalban AQ"
    }
  },
  "mulId": 373,
  "role": "Sniper",
  "source": "TR:3039"
}