{
  "id": "barghest-bgs-4x",
  "chassis": "Barghest",
  "model": "BGS-4X",
  "unitType": "BattleMech",
  "configuration": "Quad",
  "techBase": "INNER_SPHERE",
  "rulesLevel": "EXPERIMENTAL",
  "era": "CIVIL_WAR",
  "year": 3078,
  "tonnage": 70,
  "engine": {
    "type": "FUSION",
    "rating": 280
  },
  "gyro": {
    "type": "STANDARD"
  },
  "cockpit": "SMALL",
  "structure": {
    "type": "ENDO_STEEL"
  },
  "armor": {
    "type": "STANDARD",
    "allocation": {
      "FLL": 25,
      "FRL": 25,
      "LEFT_TORSO": {
        "front": 21,
        "rear": 6
      },
      "RIGHT_TORSO": {
        "front": 21,
        "rear": 6
      },
      "CENTER_TORSO": {
        "front": 28,
        "rear": 9
      },
      "HEAD": 9,
      "RLL": 25,
      "RRL": 25
    }
  },
  "heatSinks": {
    "type": "DOUBLE",
    "count": 10
  },
  "movement": {
    "walk": 4,
    "jump": 0
  },
  "equipment": [
    {
      "id": "light-ppc",
      "location": "LEFT_TORSO"
    },
    {
      "id": "light-ppc",
      "location": "LEFT_TORSO"
    },
    {
      "id": "improved-heavy-gauss-rifle",
      "location": "RIGHT_TORSO"
    }
  ],
  "criticalSlots": {
    "LEFT_TORSO": [
      "ISQuadTurret",
      "Light PPC (T)",
      "Light PPC (T)",
      "PPC Capacitor",
      "Light PPC (T)",
      "Light PPC (T)",
      "PPC Capacitor",
      "Endo Steel",
      "Endo Steel",
      "Endo Steel",
      "Endo Steel",
      "Endo Steel"
    ],
    "RIGHT_TORSO": [
      "ISImprovedHeavyGaussRifle",
      "ISImprovedHeavyGaussRifle",
      "ISImprovedHeavyGaussRifle",
      "ISImprovedHeavyGaussRifle",
      "ISImprovedHeavyGaussRifle",
      "ISImprovedHeavyGaussRifle",
      "ISImprovedHeavyGaussRifle",
      "ISImprovedHeavyGaussRifle",
      "ISImprovedHeavyGaussRifle",
      "ISImprovedHeavyGaussRifle",
      "ISImprovedHeavyGaussRifle",
      "ISCASEII"
    ],
    "CENTER_TORSO": [
      "Fusion Engine",
      "Fusion Engine",
      "Fusion Engine",
      "Gyro",
      "Gyro",
      "Gyro",
      "Gyro",
      "Fusion Engine",
      "Fusion Engine",
      "Fusion Engine",
      "ISImprovedHeavyGauss Ammo",
      "ISImprovedHeavyGauss Ammo"
    ],
    "HEAD": [
      "Life Support",
      "Sensors",
      "Cockpit",
      "Sensors",
      "ISC3SlaveUnit",
      "Endo Steel"
    ],
    "FRONT_LEFT_LEG": [
      "Hip",
      "Upper Leg Actuator",
      "Lower Leg Actuator",
      "Foot Actuator",
      "Endo Steel",
      "Endo Steel"
    ],
    "FRONT_RIGHT_LEG": [
      "Hip",
      "Upper Leg Actuator",
      "Lower Leg Actuator",
      "Foot Actuator",
      "Endo Steel",
      "Endo Steel"
    ],
    "REAR_LEFT_LEG": [
      "Hip",
      "Upper Leg Actuator",
      "Lower Leg Actuator",
      "Foot Actuator",
      "Endo Steel",
      "Endo Steel"
    ],
    "REAR_RIGHT_LEG": [
      "Hip",
      "Upper Leg Actuator",
      "Lower Leg Actuator",
      "Foot Actuator",
      "Endo Steel",
      "Endo Steel",
      "overview:During her reign over the Lyran Alliance, Katherine Steiner-Davion decided she wanted a four-legged BattleMech that would frighten its adversaries in the same way that the classic Atlas and Banshee designs did.",
      "capabilities:The Earthwerk GRF Quad chassis accommodates a Magna 350 XL engine, which saves weight and lets the 'Mech to carry a hefty weapons payload. The Barghest is shielded by thirteen tons of Durallex Heavy armor, which shields it from all but the most powerful enemy fire. The Barghest features ten double heat sinks to handle the 'Mech's heat buildup from its weaponry.",
      "deployment:Using an Improved Heavy Gauss Rifle as its main armament, this version of the Barghest also uses experimental systems to maximize protection and combat effectiveness. The Endo Steel structure and Small Cockpit save enough room to allow the 'Mech to carry two Light PPCs with PPC Capacitors in a Quad BattleMech Turret. This device allows the Barghest pilot to put accurate fire in a 360° arc around the 'Mech. To protect it from an exploding Gauss Rifle, the 'Mech also carries a CASE II system. Finally the LCAF installed a C3 slave unit in the head.",
      "history:Katrina Steiner, Archon of the Lyran Alliance, created this novel and distinctive design. The Archon notified Tharkad's TharHes Industries that she desired to build a new design with a horrific appearance, similar to that of the Atlas or the Banshee. She also desired a four-legged design. TharHes executives tried unsuccessfully to persuade her to abandon the quad design, which has been heavily criticized for decades. TharHes Industries only realized the political and military consequences of a new quad design in the Lyran Alliance Armed Forces during the final testing of the new 'Mech, when new four-legged designs debuted in the Draconis Combine and Free Worlds League militaries. The Archon dubbed the finished 'Mech Barghest after the fierce, wolf-like monsters of folklore, after seeing its animalistic elegance and power.",
      "manufacturer:TharHes Industries R&D Annex (Refit)",
      "primaryfactory:Gibbs",
      "systemmanufacturer:CHASSIS:Earthwerk BGS Endo-Quad",
      "systemmanufacturer:ENGINE:Magna 280",
      "systemmanufacturer:ARMOR:Durallex Heavy with CASE II",
      "systemmanufacturer:COMMUNICATIONS:TharHes Euterpe HM-14",
      "systemmanufacturer:TARGETING:TharHes Ares-8a"
    ]
  },
  "quirks": [
    "directional_torso_mount"
  ],
  "fluff": {
    "overview": "During her reign over the Lyran Alliance, Katherine Steiner-Davion decided she wanted a four-legged BattleMech that would frighten its adversaries in the same way that the classic Atlas and Banshee designs did.",
    "capabilities": "The Earthwerk GRF Quad chassis accommodates a Magna 350 XL engine, which saves weight and lets the 'Mech to carry a hefty weapons payload. The Barghest is shielded by thirteen tons of Durallex Heavy armor, which shields it from all but the most powerful enemy fire. The Barghest features ten double heat sinks to handle the 'Mech's heat buildup from its weaponry.",
    "history": "Katrina Steiner, Archon of the Lyran Alliance, created this novel and distinctive design. The Archon notified Tharkad's TharHes Industries that she desired to build a new design with a horrific appearance, similar to that of the Atlas or the Banshee. She also desired a four-legged design. TharHes executives tried unsuccessfully to persuade her to abandon the quad design, which has been heavily criticized for decades. TharHes Industries only realized the political and military consequences of a new quad design in the Lyran Alliance Armed Forces during the final testing of the new 'Mech, when new four-legged designs debuted in the Draconis Combine and Free Worlds League militaries. The Archon dubbed the finished 'Mech Barghest after the fierce, wolf-like monsters of folklore, after seeing its animalistic elegance and power.",
    "deployment": "Using an Improved Heavy Gauss Rifle as its main armament, this version of the Barghest also uses experimental systems to maximize protection and combat effectiveness. The Endo Steel structure and Small Cockpit save enough room to allow the 'Mech to carry two Light PPCs with PPC Capacitors in a Quad BattleMech Turret. This device allows the Barghest pilot to put accurate fire in a 360° arc around the 'Mech. To protect it from an exploding Gauss Rifle, the 'Mech also carries a CASE II system. Finally the LCAF installed a C3 slave unit in the head.",
    "manufacturer": "TharHes Industries R&D Annex (Refit)",
    "primaryFactory": "Gibbs",
    "systemManufacturer": {
      "CHASSIS": "Earthwerk BGS Endo-Quad",
      "ENGINE": "Magna 280",
      "ARMOR": "Durallex Heavy with CASE II",
      "COMMUNICATIONS": "TharHes Euterpe HM-14",
      "TARGETING": "TharHes Ares-8a"
    }
  },
  "mulId": 3791,
  "role": "Sniper",
  "source": "XTR:Steiner"
}
